hpo_id,name,definition,synonyms,text_for_embedding
HP:0000571,Hypometric saccades,"Saccadic undershoot, i.e., a saccadic eye movement that has less than the magnitude that would be required to gain fixation of the object.",[],"Hypometric saccades. Saccadic undershoot, i.e., a saccadic eye movement that has less than the magnitude that would be required to gain fixation of the object. "
HP:0000572,Visual loss,Loss of visual acuity (implying that vision was better at a certain time point in life). Otherwise the term reduced visual acuity should be used (or a subclass of that).,"['Loss of vision', 'Vision loss', 'Visual loss']",Visual loss. Loss of visual acuity (implying that vision was better at a certain time point in life). Otherwise the term reduced visual acuity should be used (or a subclass of that). Loss of vision. Vision loss. Visual loss
HP:0000573,Retinal hemorrhage,Hemorrhage occurring within the retina.,"['Retinal bleeding', 'Retinal haemorrhage', 'Retinal haemorrhages', 'Retinal hemorrhages']",Retinal hemorrhage. Hemorrhage occurring within the retina. Retinal bleeding. Retinal haemorrhage. Retinal haemorrhages. Retinal hemorrhages
HP:0000574,Thick eyebrow,Increased density/number and/or increased diameter of eyebrow hairs.,"['Bushy eyebrows', 'Dense eyebrow', 'Heavy eyebrows', 'Hypertrichosis of the eyebrow', 'Prominent eyebrows', 'Thick eyebrow', 'Thick eyebrows', 'Hypertrichosis of the eyebrows']",Thick eyebrow. Increased density/number and/or increased diameter of eyebrow hairs. Bushy eyebrows. Dense eyebrow. Heavy eyebrows. Hypertrichosis of the eyebrow. Prominent eyebrows. Thick eyebrow. Thick eyebrows. Hypertrichosis of the eyebrows
HP:0000575,Scotoma,A regional and pathological increase of the light detection threshold in any region of the visual field surrounded by a field of normal or relatively well-preserved vision.,['Blind spot'],Scotoma. A regional and pathological increase of the light detection threshold in any region of the visual field surrounded by a field of normal or relatively well-preserved vision. Blind spot
HP:0000576,Centrocecal scotoma,A scotoma (area of diminished vision within the visual field) located between the central point of fixation and the blind spot with a roughly horizontal oval shape.,[],Centrocecal scotoma. A scotoma (area of diminished vision within the visual field) located between the central point of fixation and the blind spot with a roughly horizontal oval shape. 
HP:0000577,Exotropia,A form of strabismus with one or both eyes deviated outward.,['Outward facing eye ball'],Exotropia. A form of strabismus with one or both eyes deviated outward. Outward facing eye ball
HP:0000579,Nasolacrimal duct obstruction,Blockage of the lacrimal duct.,"['Blocked tear duct', 'Lacrimal duct obstruction']",Nasolacrimal duct obstruction. Blockage of the lacrimal duct. Blocked tear duct. Lacrimal duct obstruction
HP:0000580,Pigmentary retinopathy,An abnormality of the retina characterized by pigment deposition. It is typically associated with migration and proliferation of macrophages or retinal pigment epithelial cells into the retina; melanin from these cells causes the pigmentary changes. Pigmentary retinopathy is a common final pathway of many retinal conditions and is often associated with visual loss.,"['Pigmentary retinal deposits', 'Retinal pigment clumping', 'Retinal pigmentary clumping', 'Retinal pigmentary degeneration']",Pigmentary retinopathy. An abnormality of the retina characterized by pigment deposition. It is typically associated with migration and proliferation of macrophages or retinal pigment epithelial cells into the retina; melanin from these cells causes the pigmentary changes. Pigmentary retinopathy is a common final pathway of many retinal conditions and is often associated with visual loss. Pigmentary retinal deposits. Retinal pigment clumping. Retinal pigmentary clumping. Retinal pigmentary degeneration
HP:0000581,Blepharophimosis,A fixed reduction in the vertical distance between the upper and lower eyelids with short palpebral fissures.,"['Decreased width of palpebral fissure', 'Narrow opening between the eyelids']",Blepharophimosis. A fixed reduction in the vertical distance between the upper and lower eyelids with short palpebral fissures. Decreased width of palpebral fissure. Narrow opening between the eyelids
HP:0000582,Upslanted palpebral fissure,"The palpebral fissure inclination is more than two standard deviations above the mean for age (objective); or, the inclination of the palpebral fissure is greater than typical for age.","['Mongoloid slant', 'Upslanting palpebral fissures', 'Upward slanted palpebral fissures', 'Upward slanting of palpebral fissures', 'Upward slanting of the opening between the eyelids', 'Upward slanting palpebral fissures', 'Upslanted palpebral fissures']","Upslanted palpebral fissure. The palpebral fissure inclination is more than two standard deviations above the mean for age (objective); or, the inclination of the palpebral fissure is greater than typical for age. Mongoloid slant. Upslanting palpebral fissures. Upward slanted palpebral fissures. Upward slanting of palpebral fissures. Upward slanting of the opening between the eyelids. Upward slanting palpebral fissures. Upslanted palpebral fissures"
HP:0000584,Punctate corneal epithelial erosions,,[],Punctate corneal epithelial erosions.  
HP:0000585,Band keratopathy,"An abnormality of the cornea characterized by the deposition of calcium in a band across the central cornea, leading to decreased vision, foreign body sensation, and ocular irritation.",['Calcific band keratopathy'],"Band keratopathy. An abnormality of the cornea characterized by the deposition of calcium in a band across the central cornea, leading to decreased vision, foreign body sensation, and ocular irritation. Calcific band keratopathy"
HP:0000586,Shallow orbits,Reduced depth of the orbits associated with prominent-appearing ocular globes.,"['Decreased depth of eye sockets', 'Decreased depth of orbits', 'Shallow eye sockets', 'Small shallow orbits']",Shallow orbits. Reduced depth of the orbits associated with prominent-appearing ocular globes. Decreased depth of eye sockets. Decreased depth of orbits. Shallow eye sockets. Small shallow orbits
HP:0000587,Abnormal optic nerve morphology,Abnormality of the optic nerve.,"['Abnormality of the optic nerve', 'Optic nerve issue', 'optic nerve abnormalities']",Abnormal optic nerve morphology. Abnormality of the optic nerve. Abnormality of the optic nerve. Optic nerve issue. optic nerve abnormalities
HP:0000588,Optic disc coloboma,A cleft of the optic nerve that extends inferiorly.,"['Coloboma of optic nerve', 'Optic disc coloboma', 'Optic nerve coloboma']",Optic disc coloboma. A cleft of the optic nerve that extends inferiorly. Coloboma of optic nerve. Optic disc coloboma. Optic nerve coloboma
HP:0000589,Coloboma,A developmental defect characterized by a cleft of some portion of the eye or ocular adnexa.,"['Notched pupil', 'Ocular coloboma', 'Ocular colobomas']",Coloboma. A developmental defect characterized by a cleft of some portion of the eye or ocular adnexa. Notched pupil. Ocular coloboma. Ocular colobomas
HP:0000590,Progressive external ophthalmoplegia,Initial bilateral ptosis followed by limitation of eye movements in all directions and slowing of saccades.,"['External ophthalmoplegia, progressive']","Progressive external ophthalmoplegia. Initial bilateral ptosis followed by limitation of eye movements in all directions and slowing of saccades. External ophthalmoplegia, progressive"
HP:0000591,Abnormal sclera morphology,An abnormality of the sclera.,"['Abnormality of the outer white part of eyeball', 'Abnormality of the sclera']",Abnormal sclera morphology. An abnormality of the sclera. Abnormality of the outer white part of eyeball. Abnormality of the sclera
HP:0000592,Blue sclerae,An abnormal bluish coloration of the sclera.,"['Blue outer white part of eyeball', 'Blue sclera', 'Bluish sclerae', 'Gray sclerae', 'Grey sclerae', 'Whites of eyes are a bluish-gray color', 'Whites of eyes are a bluish-gray colour']",Blue sclerae. An abnormal bluish coloration of the sclera. Blue outer white part of eyeball. Blue sclera. Bluish sclerae. Gray sclerae. Grey sclerae. Whites of eyes are a bluish-gray color. Whites of eyes are a bluish-gray colour
HP:0000593,Abnormal anterior chamber morphology,"Abnormality of the anterior chamber, which is the space in the eye that is behind the cornea and in front of the iris.","['Abnormality of the anterior chamber', 'Anterior chamber anomalies', 'Ocular anterior chamber abnormality']","Abnormal anterior chamber morphology. Abnormality of the anterior chamber, which is the space in the eye that is behind the cornea and in front of the iris. Abnormality of the anterior chamber. Anterior chamber anomalies. Ocular anterior chamber abnormality"
HP:0000594,Shallow anterior chamber,"Reduced depth of the anterior chamber, i.e., the anteroposterior distance between the cornea and the iris is decreased.",[],"Shallow anterior chamber. Reduced depth of the anterior chamber, i.e., the anteroposterior distance between the cornea and the iris is decreased. "
HP:0000597,Ophthalmoparesis,Ophthalmoplegia is a paralysis or weakness of one or more of the muscles that control eye movement.,"['Extraocular muscle palsy', 'Extraocular muscle paralysis', 'Weakness of extraocular eye movement', 'Weakness of muscles controlling eye movement']",Ophthalmoparesis. Ophthalmoplegia is a paralysis or weakness of one or more of the muscles that control eye movement. Extraocular muscle palsy. Extraocular muscle paralysis. Weakness of extraocular eye movement. Weakness of muscles controlling eye movement
HP:0000598,Abnormality of the ear,An abnormality of the ear.,"['Abnormality of the ear', 'Ear anomaly']",Abnormality of the ear. An abnormality of the ear. Abnormality of the ear. Ear anomaly
HP:0000599,Abnormality of the frontal hairline,"An anomaly in the placement or shape of the hairline (trichion) on the forehead, that is, the border between skin on the forehead that has head hair and that does not.","['Abnormality of hairline at front of head', 'Abnormality of the frontal hairline']","Abnormality of the frontal hairline. An anomaly in the placement or shape of the hairline (trichion) on the forehead, that is, the border between skin on the forehead that has head hair and that does not. Abnormality of hairline at front of head. Abnormality of the frontal hairline"
HP:0000600,Abnormality of the pharynx,"An anomaly of the pharynx, i.e., of the tubular structure extending from the base of the skull superiorly to the esophageal inlet inferiorly.",[],"Abnormality of the pharynx. An anomaly of the pharynx, i.e., of the tubular structure extending from the base of the skull superiorly to the esophageal inlet inferiorly. "
HP:0000601,Hypotelorism,"Interpupillary distance less than 2 SD below the mean (alternatively, the appearance of an decreased interpupillary distance or closely spaced eyes).","['Abnormally close eyes', 'Closely spaced eyes', 'Decreased distance between eye sockets', 'Decreased distance between eyes', 'Decreased interpupillary distance', 'Decreased orbital separation', 'Ocular hypotelorism']","Hypotelorism. Interpupillary distance less than 2 SD below the mean (alternatively, the appearance of an decreased interpupillary distance or closely spaced eyes). Abnormally close eyes. Closely spaced eyes. Decreased distance between eye sockets. Decreased distance between eyes. Decreased interpupillary distance. Decreased orbital separation. Ocular hypotelorism"
HP:0000602,Ophthalmoplegia,Paralysis of one or more extraocular muscles that are responsible for eye movements.,"['Eye muscle paralysis', 'Paralysis of extraocular eye movement']",Ophthalmoplegia. Paralysis of one or more extraocular muscles that are responsible for eye movements. Eye muscle paralysis. Paralysis of extraocular eye movement
HP:0000603,Central scotoma,An area of depressed vision located at the point of fixation and that interferes with central vision.,"['Blind spot located at fixation point', 'Central blind spot', 'Central scotomata']",Central scotoma. An area of depressed vision located at the point of fixation and that interferes with central vision. Blind spot located at fixation point. Central blind spot. Central scotomata
HP:0000605,Supranuclear gaze palsy,"A supranuclear gaze palsy is an inability to look in a particular direction as a result of cerebral impairment. There is a loss of the voluntary aspect of eye movements, but, as the brainstem is still intact, all the reflex conjugate eye movements are normal.",['Supranuclear gaze paralysis'],"Supranuclear gaze palsy. A supranuclear gaze palsy is an inability to look in a particular direction as a result of cerebral impairment. There is a loss of the voluntary aspect of eye movements, but, as the brainstem is still intact, all the reflex conjugate eye movements are normal. Supranuclear gaze paralysis"
HP:0000606,Abnormality of the periorbital region,An abnormality of the region situated around the orbit of the eye.,"['Abnormality of the region around the eye', 'Abnormality of the region around the eye socket', 'Anomaly of the periorbital region', 'Deformity of the periorbital region', 'Malformation of the periorbital region']",Abnormality of the periorbital region. An abnormality of the region situated around the orbit of the eye. Abnormality of the region around the eye. Abnormality of the region around the eye socket. Anomaly of the periorbital region. Deformity of the periorbital region. Malformation of the periorbital region
HP:0000607,Periorbital wrinkles,,"['Excess periorbital skin wrinkling', 'Periorbital rhytids', 'Periorbital wrinkling', 'Wrinkles around the eyes']",Periorbital wrinkles.  Excess periorbital skin wrinkling. Periorbital rhytids. Periorbital wrinkling. Wrinkles around the eyes
HP:0000608,Macular degeneration,A nonspecific term denoting degeneration of the retinal pigment epithelium and/or retinal photoreceptor cells of the macula lutea.,['Pigmented macular degeneration'],Macular degeneration. A nonspecific term denoting degeneration of the retinal pigment epithelium and/or retinal photoreceptor cells of the macula lutea. Pigmented macular degeneration
HP:0000609,Optic nerve hypoplasia,Underdevelopment of the optic nerve.,"['Hypoplastic optic nerves', 'Underdeveloped optic nerves', 'Double ring sign']",Optic nerve hypoplasia. Underdevelopment of the optic nerve. Hypoplastic optic nerves. Underdeveloped optic nerves. Double ring sign
HP:0000610,Abnormal choroid morphology,Any structural abnormality of the choroid.,"['Abnormality of the choroid', 'Choroid disease']",Abnormal choroid morphology. Any structural abnormality of the choroid. Abnormality of the choroid. Choroid disease
HP:0000611,obsolete Choroid coloboma,,[],obsolete Choroid coloboma.  
HP:0000612,Iris coloboma,A coloboma of the iris.,"['Cat eye', 'Coloboma of iris', 'Coloboma of the iris', 'Keyhole iris']",Iris coloboma. A coloboma of the iris. Cat eye. Coloboma of iris. Coloboma of the iris. Keyhole iris
HP:0000613,Photophobia,Excessive sensitivity to light with the sensation of discomfort or pain in the eyes due to exposure to bright light.,"['Extreme sensitivity of the eyes to light', 'Light hypersensitivity', 'Photodysphoria']",Photophobia. Excessive sensitivity to light with the sensation of discomfort or pain in the eyes due to exposure to bright light. Extreme sensitivity of the eyes to light. Light hypersensitivity. Photodysphoria
HP:0000614,Abnormal nasolacrimal system morphology,"An abnormality of the nasolacrimal drainage system, which serves as a conduit for tear flow from the external eye to the nasal cavity.",['Abnormality of the nasolacrimal system'],"Abnormal nasolacrimal system morphology. An abnormality of the nasolacrimal drainage system, which serves as a conduit for tear flow from the external eye to the nasal cavity. Abnormality of the nasolacrimal system"
HP:0000615,Abnormal pupil morphology,An abnormality of the pupil.,"['Abnormal pupillary morphology', 'Abnormality of the pupil', 'Pupillary abnormalities', 'Pupillary abnormality']",Abnormal pupil morphology. An abnormality of the pupil. Abnormal pupillary morphology. Abnormality of the pupil. Pupillary abnormalities. Pupillary abnormality
HP:0000616,Miosis,Abnormal (non-physiological) constriction of the pupil.,"['Constricted pupils', 'Pupillary constriction']",Miosis. Abnormal (non-physiological) constriction of the pupil. Constricted pupils. Pupillary constriction
HP:0000617,Abnormality of ocular smooth pursuit,An abnormality of eye movement characterized by impaired smooth-pursuit eye movements.,"['Abnormal smooth pursuits', 'Disrupted ocular pursuit movements', 'Impaired smooth pursuit ocular movements', 'Irregular visual pursuit movements']",Abnormality of ocular smooth pursuit. An abnormality of eye movement characterized by impaired smooth-pursuit eye movements. Abnormal smooth pursuits. Disrupted ocular pursuit movements. Impaired smooth pursuit ocular movements. Irregular visual pursuit movements
HP:0000618,Blindness,"Blindness is the condition of lacking visual perception defined as a profound reduction in visual perception. On the 6m visual acuity scale, blindness is defined as less than 3/60. On the 20ft visual acuity scale, blindness is defined as less than 20/400. On the decimal visual acuity scale, blindness is defined as less than 0.05. Blindness is typically characterized by a visual field of no greater than 10 degrees in radius around central fixation.","['Blindness', 'Total vision loss', 'Legal blindness']","Blindness. Blindness is the condition of lacking visual perception defined as a profound reduction in visual perception. On the 6m visual acuity scale, blindness is defined as less than 3/60. On the 20ft visual acuity scale, blindness is defined as less than 20/400. On the decimal visual acuity scale, blindness is defined as less than 0.05. Blindness is typically characterized by a visual field of no greater than 10 degrees in radius around central fixation. Blindness. Total vision loss. Legal blindness"
HP:0000619,Impaired convergence,Reduced ability to turn the eyes inward in order to focus on a nearby object.,['Convergence insufficiency'],Impaired convergence. Reduced ability to turn the eyes inward in order to focus on a nearby object. Convergence insufficiency
HP:0000620,Dacryocystitis,Inflammation of the nasolacrimal sac.,"['Dacrocystitis', 'Infection of the lacrimal sac']",Dacryocystitis. Inflammation of the nasolacrimal sac. Dacrocystitis. Infection of the lacrimal sac
HP:0000621,Entropion,An abnormal inversion (turning inward) of the eyelid (usually the lower) towards the globe. Entropion is usually acquired as a result of involutional or cicatricial processes but may occasionally be congenital.,"['Eyelid folded in', 'Eyelid turned in', 'Inverted eyelid']",Entropion. An abnormal inversion (turning inward) of the eyelid (usually the lower) towards the globe. Entropion is usually acquired as a result of involutional or cicatricial processes but may occasionally be congenital. Eyelid folded in. Eyelid turned in. Inverted eyelid
HP:0000622,Blurred vision,Lack of sharpness of vision resulting in the inability to see fine detail.,['Blurred vision'],Blurred vision. Lack of sharpness of vision resulting in the inability to see fine detail. Blurred vision
HP:0000623,Supranuclear ophthalmoplegia,A vertical gaze palsy with inability to direct the gaze of the eyes downwards.,[],Supranuclear ophthalmoplegia. A vertical gaze palsy with inability to direct the gaze of the eyes downwards. 
HP:0000625,Eyelid coloboma,A short discontinuity of the margin of the lower or upper eyelid.,"['Cleft eyelid', 'Full thickness defect of the eyelid', 'Notched eyelid']",Eyelid coloboma. A short discontinuity of the margin of the lower or upper eyelid. Cleft eyelid. Full thickness defect of the eyelid. Notched eyelid
HP:0000627,Posterior embryotoxon,A posterior embryotoxon is the presence of a prominent and anteriorly displaced line of Schwalbe.,['Embryotoxon'],Posterior embryotoxon. A posterior embryotoxon is the presence of a prominent and anteriorly displaced line of Schwalbe. Embryotoxon
HP:0000629,Periorbital fullness,Increase in periorbital soft tissue.,"['Periorbital puffiness', 'Periorbital swelling', 'Puffiness around eye', 'Puffy eyes', 'Swelling around the eyes', 'Fullness around the eyes']",Periorbital fullness. Increase in periorbital soft tissue. Periorbital puffiness. Periorbital swelling. Puffiness around eye. Puffy eyes. Swelling around the eyes. Fullness around the eyes
HP:0000630,Abnormal retinal artery morphology,,"['Abnormality of retinal arteries', 'Retinal arterial abnormality']",Abnormal retinal artery morphology.  Abnormality of retinal arteries. Retinal arterial abnormality
HP:0000631,Retinal arterial tortuosity,The presence of an increased number of twists and turns of the retinal artery.,['Retinal artery tortuousity'],Retinal arterial tortuosity. The presence of an increased number of twists and turns of the retinal artery. Retinal artery tortuousity
HP:0000632,Lacrimation abnormality,Abnormality of tear production.,['Abnormality of tear production'],Lacrimation abnormality. Abnormality of tear production. Abnormality of tear production
HP:0000633,Decreased lacrimation,"Abnormally decreased lacrimation, that is, reduced tear production.","['Decreased tear secretion', 'Hypolacrimia']","Decreased lacrimation. Abnormally decreased lacrimation, that is, reduced tear production. Decreased tear secretion. Hypolacrimia"
HP:0000634,Impaired ocular abduction,An impaired ability of the eye to move in the outward direction (towards the side of the head).,[],Impaired ocular abduction. An impaired ability of the eye to move in the outward direction (towards the side of the head). 
HP:0000635,Blue irides,A markedly blue coloration of the iris.,['Blue eyes'],Blue irides. A markedly blue coloration of the iris. Blue eyes
HP:0000636,Upper eyelid coloboma,A short discontinuity of the margin of the upper eyelid.,"['Cleft upper eyelid', 'Coloboma of the upper eyelid', 'Full thickness defect of the upper eyelid', 'Notched upper eyelid', 'Upper eyelid colobomas']",Upper eyelid coloboma. A short discontinuity of the margin of the upper eyelid. Cleft upper eyelid. Coloboma of the upper eyelid. Full thickness defect of the upper eyelid. Notched upper eyelid. Upper eyelid colobomas
HP:0000637,Long palpebral fissure,"Distance between medial and lateral canthi is more than two standard deviations above the mean for age (objective); or, apparently increased length of the palpebral fissures.","['Broad opening between the eyelids', 'Broad palpebral fissure', 'Long opening between the eyelids', 'Long palpebral fissures', 'Wide opening between the eyelids', 'Wide palpebral fissure', 'Wide palpebral fissures']","Long palpebral fissure. Distance between medial and lateral canthi is more than two standard deviations above the mean for age (objective); or, apparently increased length of the palpebral fissures. Broad opening between the eyelids. Broad palpebral fissure. Long opening between the eyelids. Long palpebral fissures. Wide opening between the eyelids. Wide palpebral fissure. Wide palpebral fissures"
HP:0000639,Nystagmus,"Rhythmic, involuntary oscillations of one or both eyes related to abnormality in fixation, conjugate gaze, or vestibular mechanisms.","['Involuntary, rapid, rhythmic eye movements']","Nystagmus. Rhythmic, involuntary oscillations of one or both eyes related to abnormality in fixation, conjugate gaze, or vestibular mechanisms. Involuntary, rapid, rhythmic eye movements"
HP:0000640,Gaze-evoked nystagmus,Nystagmus made apparent by looking to the right or to the left.,[],Gaze-evoked nystagmus. Nystagmus made apparent by looking to the right or to the left. 
HP:0000641,Dysmetric saccades,"The controller signal for saccadic eye movements has two components: the pulse that moves the eye rapidly from one point to the next, and the step that holds the eye in the new position. When both the pulse and the step are not the correct size, a dysmetric refixation eye movement results.","['Dysmetric eye movements', 'Dysmetric eye saccades', 'Uncoordinated eye movement']","Dysmetric saccades. The controller signal for saccadic eye movements has two components: the pulse that moves the eye rapidly from one point to the next, and the step that holds the eye in the new position. When both the pulse and the step are not the correct size, a dysmetric refixation eye movement results. Dysmetric eye movements. Dysmetric eye saccades. Uncoordinated eye movement"
HP:0000642,Red-green dyschromatopsia,Difficulty with discriminating red and green hues.,"['Dyschromatopsia with red-green confusion', 'Red green color blindness', 'Red green colour blindness', 'Red/green color vision defect', 'Red/green colour vision defect']",Red-green dyschromatopsia. Difficulty with discriminating red and green hues. Dyschromatopsia with red-green confusion. Red green color blindness. Red green colour blindness. Red/green color vision defect. Red/green colour vision defect
HP:0000643,Blepharospasm,"A focal dystonia that affects the muscles of the eyelids and brow, associated with involuntary recurrent spasm of both eyelids.","['Eyelid spasm', 'Eyelid twitching', 'Involuntary closure of eyelid', 'Spontaneous closure of eyelid']","Blepharospasm. A focal dystonia that affects the muscles of the eyelids and brow, associated with involuntary recurrent spasm of both eyelids. Eyelid spasm. Eyelid twitching. Involuntary closure of eyelid. Spontaneous closure of eyelid"
