hpo_id,name,definition,synonyms,text_for_embedding
HP:0000940,Abnormal diaphysis morphology,"An abnormality of the structure or form of the diaphysis, i.e., of the main or mid-section (shaft) of a long bone.","['Abnormal shape of shaft of long bone', 'Abnormality involving the diaphyses of the limbs', 'Abnormality of shaft of long bone of the limbs', 'Abnormality of the diaphyses', 'Anomaly of the limb diaphyses', 'Anomaly of the limb diaphyses morphology']","Abnormal diaphysis morphology. An abnormality of the structure or form of the diaphysis, i.e., of the main or mid-section (shaft) of a long bone. Abnormal shape of shaft of long bone. Abnormality involving the diaphyses of the limbs. Abnormality of shaft of long bone of the limbs. Abnormality of the diaphyses. Anomaly of the limb diaphyses. Anomaly of the limb diaphyses morphology"
HP:0000941,Short diaphyses,,['Short shaft of long bone'],Short diaphyses.  Short shaft of long bone
HP:0000943,Dysostosis multiplex,,[],Dysostosis multiplex.  
HP:0000944,Abnormal metaphysis morphology,"An abnormality of one or more metaphysis, i.e., of the somewhat wider portion of a long bone that is adjacent to the epiphyseal growth plate and grows during childhood.",['Abnormality of the wide portion of a long bone'],"Abnormal metaphysis morphology. An abnormality of one or more metaphysis, i.e., of the somewhat wider portion of a long bone that is adjacent to the epiphyseal growth plate and grows during childhood. Abnormality of the wide portion of a long bone"
HP:0000946,Hypoplastic ilia,Underdevelopment of the ilium.,"['Small wings of the pelvic girdle', 'Short and small iliac bones', 'Small iliac bones']",Hypoplastic ilia. Underdevelopment of the ilium. Small wings of the pelvic girdle. Short and small iliac bones. Small iliac bones
HP:0000947,Dumbbell-shaped long bone,"An abnormal appearance of the long bones with resemblance to a dumbbell, a short bar with a weight at each end. That is, the long bone is shortened and displays flaring (widening) of the metaphyses.","['Dumbbell widening of long bone metaphyses', 'Dumbbell-shaped long bone']","Dumbbell-shaped long bone. An abnormal appearance of the long bones with resemblance to a dumbbell, a short bar with a weight at each end. That is, the long bone is shortened and displays flaring (widening) of the metaphyses. Dumbbell widening of long bone metaphyses. Dumbbell-shaped long bone"
HP:0000951,Abnormality of the skin,An abnormality of the skin.,"['Abnormality of the skin', 'Dermatopathy', 'Dermopathy', 'Skin abnormality']",Abnormality of the skin. An abnormality of the skin. Abnormality of the skin. Dermatopathy. Dermopathy. Skin abnormality
HP:0000952,Jaundice,"Yellow pigmentation of the skin due to bilirubin, which in turn is the result of increased bilirubin concentration in the bloodstream.","['Icterus', 'Jaundice', 'Yellow skin', 'Yellowing of the skin']","Jaundice. Yellow pigmentation of the skin due to bilirubin, which in turn is the result of increased bilirubin concentration in the bloodstream. Icterus. Jaundice. Yellow skin. Yellowing of the skin"
HP:0000953,Hyperpigmentation of the skin,A darkening of the skin related to an increase in melanin production and deposition.,"['Cutaneous hyperpigmentation', 'Hyperpigmented lesion', 'Increased skin pigmentation', 'Patchy darkened skin', 'Skin hyperpigmentation', 'Melanoderma', 'Melanodermia']",Hyperpigmentation of the skin. A darkening of the skin related to an increase in melanin production and deposition. Cutaneous hyperpigmentation. Hyperpigmented lesion. Increased skin pigmentation. Patchy darkened skin. Skin hyperpigmentation. Melanoderma. Melanodermia
HP:0000954,Single transverse palmar crease,The distal and proximal transverse palmar creases are merged into a single transverse palmar crease.,"['Simian crease', 'Simian creases', 'Simian line', 'Single flexion crease', 'Single palmar crease', 'Single palmar creases', 'Single transverse palmar creases', 'Transverse palmar crease']",Single transverse palmar crease. The distal and proximal transverse palmar creases are merged into a single transverse palmar crease. Simian crease. Simian creases. Simian line. Single flexion crease. Single palmar crease. Single palmar creases. Single transverse palmar creases. Transverse palmar crease
HP:0000956,Acanthosis nigricans,"A dermatosis characterized by thickened, hyperpigmented plaques, typically on the intertriginous surfaces and neck.","['Darkened and thickened skin', 'Keratosis nigricans']","Acanthosis nigricans. A dermatosis characterized by thickened, hyperpigmented plaques, typically on the intertriginous surfaces and neck. Darkened and thickened skin. Keratosis nigricans"
HP:0000957,Cafe-au-lait spot,Cafe-au-lait spots are hyperpigmented lesions that can vary in color from light brown to dark brown with smooth borders and having a size of 1.5 cm or more in adults and 0.5 cm or more in children.,"['Birthmark', 'Flat light-brown mark on skin', 'Cafe au lait spots', 'Cafe-au-lait macule', 'Cafe-au-lait macules', 'Cafe-au-lait spots']",Cafe-au-lait spot. Cafe-au-lait spots are hyperpigmented lesions that can vary in color from light brown to dark brown with smooth borders and having a size of 1.5 cm or more in adults and 0.5 cm or more in children. Birthmark. Flat light-brown mark on skin. Cafe au lait spots. Cafe-au-lait macule. Cafe-au-lait macules. Cafe-au-lait spots
HP:0000958,Dry skin,Skin characterized by the lack of natural or normal moisture.,"['Dry skin', 'Xerosis']",Dry skin. Skin characterized by the lack of natural or normal moisture. Dry skin. Xerosis
HP:0000960,Sacral dimple,A cutaneous indentation resulting from tethering of the skin to underlying structures (bone) of the intergluteal cleft.,"['Pilonidal dimple', 'Spinal dimple']",Sacral dimple. A cutaneous indentation resulting from tethering of the skin to underlying structures (bone) of the intergluteal cleft. Pilonidal dimple. Spinal dimple
HP:0000961,Cyanosis,Bluish discoloration of the skin and mucosa due to poor circulation or inadequate oxygenation of arterial or capillary blood.,['Blue discoloration of the skin'],Cyanosis. Bluish discoloration of the skin and mucosa due to poor circulation or inadequate oxygenation of arterial or capillary blood. Blue discoloration of the skin
HP:0000962,Hyperkeratosis,"Hyperkeratosis is thickening of the epidermis involving the outer layer of the skin, the stratum corneum, which is composed of large, polyhedral, plate-like envelopes filled with keratin which are the dead cells that have migrated up from the stratum granulosum.",['Epidermal hyperkeratosis'],"Hyperkeratosis. Hyperkeratosis is thickening of the epidermis involving the outer layer of the skin, the stratum corneum, which is composed of large, polyhedral, plate-like envelopes filled with keratin which are the dead cells that have migrated up from the stratum granulosum. Epidermal hyperkeratosis"
HP:0000963,Thin skin,"Reduction in thickness of the skin, generally associated with a loss of suppleness and elasticity of the skin.",['Thin skin'],"Thin skin. Reduction in thickness of the skin, generally associated with a loss of suppleness and elasticity of the skin. Thin skin"
HP:0000964,Eczematoid dermatitis,"Eczema is a form of dermatitis that is characterized by scaly, pruritic, erythematous lesions located on flexural surfaces.",['Eczema'],"Eczematoid dermatitis. Eczema is a form of dermatitis that is characterized by scaly, pruritic, erythematous lesions located on flexural surfaces. Eczema"
HP:0000965,Cutis marmorata,"A reticular discoloration of the skin with cyanotic (reddish-blue appearing) areas surrounding pale central areas due to dilation of capillary blood vessels and stagnation of blood within the vessels. Cutis marmorata generally occurs on the legs, arms and trunk and is often more severe in cold weather.",[],"Cutis marmorata. A reticular discoloration of the skin with cyanotic (reddish-blue appearing) areas surrounding pale central areas due to dilation of capillary blood vessels and stagnation of blood within the vessels. Cutis marmorata generally occurs on the legs, arms and trunk and is often more severe in cold weather. "
HP:0000966,Hypohidrosis,Abnormally diminished capacity to sweat.,"['Decreased ability to sweat', 'Decreased sweating', 'Inadequate sweating', 'Oligohidrosis', 'Sweating, decreased']","Hypohidrosis. Abnormally diminished capacity to sweat. Decreased ability to sweat. Decreased sweating. Inadequate sweating. Oligohidrosis. Sweating, decreased"
HP:0000967,Petechiae,"Petechiae are pinpoint-sized reddish/purple spots, resembling a rash, that appear just under the skin or a mucous membrane when capillaries have ruptured and some superficial bleeding into the skin has happened. This term refers to an abnormally increased susceptibility to developing petechiae.",[],"Petechiae. Petechiae are pinpoint-sized reddish/purple spots, resembling a rash, that appear just under the skin or a mucous membrane when capillaries have ruptured and some superficial bleeding into the skin has happened. This term refers to an abnormally increased susceptibility to developing petechiae. "
HP:0000968,Ectodermal dysplasia,"Ectodermal dysplasia is a group of conditions in which there is abnormal development of the skin, hair, nails, teeth, or sweat glands.",[],"Ectodermal dysplasia. Ectodermal dysplasia is a group of conditions in which there is abnormal development of the skin, hair, nails, teeth, or sweat glands. "
HP:0000969,Edema,"An abnormal accumulation of fluid beneath the skin, or in one or more cavities of the body.","['Soft tissue swelling', 'Dropsy', 'Fluid retention', 'Hydrops', 'Oedema', 'Water retention']","Edema. An abnormal accumulation of fluid beneath the skin, or in one or more cavities of the body. Soft tissue swelling. Dropsy. Fluid retention. Hydrops. Oedema. Water retention"
HP:0000970,Anhidrosis,Inability to sweat.,"['Anhydrosis', 'Lack of sweating', 'Sudomotor dysfunction', 'Sweating dysfunction']",Anhidrosis. Inability to sweat. Anhydrosis. Lack of sweating. Sudomotor dysfunction. Sweating dysfunction
HP:0000971,Abnormal sweat gland morphology,Any structural abnormality of the sweat gland.,"['Abnormality of the sweat gland', 'Abnormalities of sweating', 'Sweat gland disease']",Abnormal sweat gland morphology. Any structural abnormality of the sweat gland. Abnormality of the sweat gland. Abnormalities of sweating. Sweat gland disease
HP:0000972,Palmoplantar hyperkeratosis,Abnormal thickening of the skin localized to the palm of the hand and the sole of the foot.,"['Hyperkeratosis of palms and soles', 'Hyperkeratosis of the palms and soles', 'Palmoplantar keratoses', 'Palmoplantar keratosis', 'Thick palms and soles', 'Thickened palms and soles', 'Thickening of the outer layer of the skin of the palms and soles']",Palmoplantar hyperkeratosis. Abnormal thickening of the skin localized to the palm of the hand and the sole of the foot. Hyperkeratosis of palms and soles. Hyperkeratosis of the palms and soles. Palmoplantar keratoses. Palmoplantar keratosis. Thick palms and soles. Thickened palms and soles. Thickening of the outer layer of the skin of the palms and soles
HP:0000973,Cutis laxa,"Wrinkled, redundant, inelastic and sagging skin.","['Hanging skin', 'Chalazoderma', 'Cutaneous laxity', 'Dermatochalasia', 'Dermatomegaly', 'Elastolysis', 'Generalised elastolysis', 'Generalized elastolysis', 'Hypoelastic skin', 'Inelastic skin', 'Lax skin', 'Loose and inelastic skin', 'Loose skin', 'Skin laxity']","Cutis laxa. Wrinkled, redundant, inelastic and sagging skin. Hanging skin. Chalazoderma. Cutaneous laxity. Dermatochalasia. Dermatomegaly. Elastolysis. Generalised elastolysis. Generalized elastolysis. Hypoelastic skin. Inelastic skin. Lax skin. Loose and inelastic skin. Loose skin. Skin laxity"
HP:0000974,Hyperextensible skin,"A condition in which the skin can be stretched beyond normal, and then returns to its initial position.","['Hyperelastic skin', 'Skin hyperelasticity', 'Skin hyperextensibility', 'Stretchable skin']","Hyperextensible skin. A condition in which the skin can be stretched beyond normal, and then returns to its initial position. Hyperelastic skin. Skin hyperelasticity. Skin hyperextensibility. Stretchable skin"
HP:0000975,Hyperhidrosis,Abnormal excessive perspiration (sweating) despite the lack of appropriate stimuli like hot and humid weather.,"['Diaphoresis', 'Excessive sweating', 'Increased sweating', 'Profuse sweating', 'Sweating', 'Sweating profusely', 'Sweating, increased']","Hyperhidrosis. Abnormal excessive perspiration (sweating) despite the lack of appropriate stimuli like hot and humid weather. Diaphoresis. Excessive sweating. Increased sweating. Profuse sweating. Sweating. Sweating profusely. Sweating, increased"
HP:0000976,obsolete Eczematoid dermatitis,,[],obsolete Eczematoid dermatitis.  
HP:0000977,Soft skin,Subjective impression of increased softness upon palpation of the skin.,"['Soft skin', 'Velvety skin', 'Velvety skin texture']",Soft skin. Subjective impression of increased softness upon palpation of the skin. Soft skin. Velvety skin. Velvety skin texture
HP:0000978,Bruising susceptibility,An ecchymosis (bruise) refers to the skin discoloration caused by the escape of blood into the tissues from ruptured blood vessels. This term refers to an abnormally increased susceptibility to bruising. The corresponding phenotypic abnormality is generally elicited on medical history as a report of frequent ecchymoses or bruising without adequate trauma.,"['Bruisability', 'Bruise easily', 'Bruising susceptibility', 'Easy bruisability', 'Easy bruising']",Bruising susceptibility. An ecchymosis (bruise) refers to the skin discoloration caused by the escape of blood into the tissues from ruptured blood vessels. This term refers to an abnormally increased susceptibility to bruising. The corresponding phenotypic abnormality is generally elicited on medical history as a report of frequent ecchymoses or bruising without adequate trauma. Bruisability. Bruise easily. Bruising susceptibility. Easy bruisability. Easy bruising
HP:0000979,Purpura,"Purpura (from Latin: purpura, meaning purple) is the appearance of red or purple discolorations on the skin that do not blanch on applying pressure. They are caused by bleeding underneath the skin. This term refers to an abnormally increased susceptibility to developing purpura. Purpura are larger than petechiae.","['Blood spots', 'Red or purple spots on the skin']","Purpura. Purpura (from Latin: purpura, meaning purple) is the appearance of red or purple discolorations on the skin that do not blanch on applying pressure. They are caused by bleeding underneath the skin. This term refers to an abnormally increased susceptibility to developing purpura. Purpura are larger than petechiae. Blood spots. Red or purple spots on the skin"
HP:0000980,Pallor,Abnormally pale skin.,"['Paleness', 'Skin paleness']",Pallor. Abnormally pale skin. Paleness. Skin paleness
HP:0000982,Palmoplantar keratoderma,Abnormal thickening of the skin of the palms of the hands and the soles of the feet.,"['Palmar and plantar keratoderma', 'Thickening of palms and soles']",Palmoplantar keratoderma. Abnormal thickening of the skin of the palms of the hands and the soles of the feet. Palmar and plantar keratoderma. Thickening of palms and soles
HP:0000987,Atypical scarring of skin,Atypically scarred skin .,"['Atypical scarring', 'Atypical scarring of skin']",Atypical scarring of skin. Atypically scarred skin . Atypical scarring. Atypical scarring of skin
HP:0000988,Skin rash,A red eruption of the skin.,"['Rash', 'Skin rash']",Skin rash. A red eruption of the skin. Rash. Skin rash
HP:0000989,Pruritus,Pruritus is an itch or a sensation that makes a person want to scratch. This term refers to an abnormally increased disposition to experience pruritus.,"['Itching', 'Itchy skin', 'Skin itching']",Pruritus. Pruritus is an itch or a sensation that makes a person want to scratch. This term refers to an abnormally increased disposition to experience pruritus. Itching. Itchy skin. Skin itching
HP:0000991,Xanthomatosis,"The presence of multiple xanthomas (xanthomata) in the skin. Xanthomas are yellowish, firm, lipid-laden nodules in the skin.","['Xanthomata', 'Yellow bumps of fatty deposits on skin']","Xanthomatosis. The presence of multiple xanthomas (xanthomata) in the skin. Xanthomas are yellowish, firm, lipid-laden nodules in the skin. Xanthomata. Yellow bumps of fatty deposits on skin"
HP:0000992,Cutaneous photosensitivity,An increased sensitivity of the skin to light. Photosensitivity may result in a rash upon exposure to the sun (which is known as photodermatosis). Photosensitivity can be diagnosed by phototests in which light is shone on small areas of skin.,"['Photosensitive skin', 'Photosensitive skin rashes', 'Photosensitivity', 'Sensitivity to sunlight', 'Skin photosensitivity', 'Sun sensitivity']",Cutaneous photosensitivity. An increased sensitivity of the skin to light. Photosensitivity may result in a rash upon exposure to the sun (which is known as photodermatosis). Photosensitivity can be diagnosed by phototests in which light is shone on small areas of skin. Photosensitive skin. Photosensitive skin rashes. Photosensitivity. Sensitivity to sunlight. Skin photosensitivity. Sun sensitivity
HP:0000993,Molluscoid pseudotumors,"Bluish-grey, spongy nodules associated with scars over pressure points and easily traumatized areas like the elbows and knees.",['Molluscoid pseudotumor'],"Molluscoid pseudotumors. Bluish-grey, spongy nodules associated with scars over pressure points and easily traumatized areas like the elbows and knees. Molluscoid pseudotumor"
HP:0000995,Melanocytic nevus,"A oval and round, colored (usually medium-to dark brown, reddish brown, or flesh colored) lesion. Typically, a melanocytic nevus is less than 6 mm in diameter, but may be much smaller or larger.","['Noncancerous mole', 'Beauty mark', 'Melanocytic naevus', 'Melanocytic nevi', 'Nevocellular nevi', 'Pigmented naevi', 'Pigmented nevi']","Melanocytic nevus. A oval and round, colored (usually medium-to dark brown, reddish brown, or flesh colored) lesion. Typically, a melanocytic nevus is less than 6 mm in diameter, but may be much smaller or larger. Noncancerous mole. Beauty mark. Melanocytic naevus. Melanocytic nevi. Nevocellular nevi. Pigmented naevi. Pigmented nevi"
HP:0000996,Facial capillary hemangioma,"Hemangioma, a benign tumor of the vascular endothelial cells with small endothelial spaces, occurring in the face.",[],"Facial capillary hemangioma. Hemangioma, a benign tumor of the vascular endothelial cells with small endothelial spaces, occurring in the face. "
HP:0000997,Axillary freckling,"The presence in the axillary region (armpit) of an increased number of freckles, small circular spots on the skin that are darker than the surrounding skin because of deposits of melanin.",[],"Axillary freckling. The presence in the axillary region (armpit) of an increased number of freckles, small circular spots on the skin that are darker than the surrounding skin because of deposits of melanin. "
HP:0000998,Hypertrichosis,Hypertrichosis is increased hair growth that is abnormal in quantity or location.,"['Excessive hair growth', 'Increased hair growth on body']",Hypertrichosis. Hypertrichosis is increased hair growth that is abnormal in quantity or location. Excessive hair growth. Increased hair growth on body
HP:0000999,Pyoderma,Any manifestation of a skin disease associated with the production of pus.,['Pus-filled lesion'],Pyoderma. Any manifestation of a skin disease associated with the production of pus. Pus-filled lesion
HP:0001000,Abnormality of skin pigmentation,An abnormality of the pigmentation of the skin.,"['Abnormal pigmentation', 'Abnormal skin color', 'Abnormal skin colour', 'Abnormal skin pigmentation', 'Abnormality of pigmentation', 'Abnormality of skin pigmentation', 'Pigmentary changes', 'Pigmentary skin changes', 'Pigmentation anomaly']",Abnormality of skin pigmentation. An abnormality of the pigmentation of the skin. Abnormal pigmentation. Abnormal skin color. Abnormal skin colour. Abnormal skin pigmentation. Abnormality of pigmentation. Abnormality of skin pigmentation. Pigmentary changes. Pigmentary skin changes. Pigmentation anomaly
HP:0001001,Abnormality of subcutaneous fat tissue,,['Abnormality of fatty tissue below the skin'],Abnormality of subcutaneous fat tissue.  Abnormality of fatty tissue below the skin
HP:0001002,obsolete Decreased subcutaneous fat,,[],obsolete Decreased subcutaneous fat.  
HP:0001003,Multiple lentigines,"Presence of an unusually high number of lentigines (singular: lentigo), which are flat, tan to brown oval spots.",['Liver spots'],"Multiple lentigines. Presence of an unusually high number of lentigines (singular: lentigo), which are flat, tan to brown oval spots. Liver spots"
HP:0001004,Lymphedema,Localized fluid retention and tissue swelling caused by a compromised lymphatic system.,"['Lymphatic obstruction', 'Lymphoedema', 'Onset of lymphedema around puberty', 'Swelling caused by excess lymph fluid under skin']",Lymphedema. Localized fluid retention and tissue swelling caused by a compromised lymphatic system. Lymphatic obstruction. Lymphoedema. Onset of lymphedema around puberty. Swelling caused by excess lymph fluid under skin
HP:0001005,Dermatological manifestations of systemic disorders,,[],Dermatological manifestations of systemic disorders.  
HP:0001006,obsolete Hypotrichosis,,[],obsolete Hypotrichosis.  
HP:0001007,Hirsutism,Abnormally increased hair growth referring to a male pattern of body hair (androgenic hair).,['Excessive hairiness'],Hirsutism. Abnormally increased hair growth referring to a male pattern of body hair (androgenic hair). Excessive hairiness
HP:0001008,Accumulation of melanosomes in melanocytes,,[],Accumulation of melanosomes in melanocytes.  
HP:0001009,Telangiectasia,"Telangiectasias refer to small dilated blood vessels located near the surface of the skin or mucous membranes, measuring between 0.5 and 1 millimeter in diameter. Telangiectasia are located especially on the tongue, lips, palate, fingers, face, conjunctiva, trunk, nail beds, and fingertips.","['Telangiectases', 'Spider veins']","Telangiectasia. Telangiectasias refer to small dilated blood vessels located near the surface of the skin or mucous membranes, measuring between 0.5 and 1 millimeter in diameter. Telangiectasia are located especially on the tongue, lips, palate, fingers, face, conjunctiva, trunk, nail beds, and fingertips. Telangiectases. Spider veins"
HP:0001010,Hypopigmentation of the skin,A reduction of skin color related to a decrease in melanin production and deposition.,"['Hypopigmentation', 'Hypopigmented skin', 'Patchy lightened skin', 'Skin hypopigmentation']",Hypopigmentation of the skin. A reduction of skin color related to a decrease in melanin production and deposition. Hypopigmentation. Hypopigmented skin. Patchy lightened skin. Skin hypopigmentation
HP:0001011,obsolete Diaphoresis (with pheochromocytoma),,[],obsolete Diaphoresis (with pheochromocytoma).  
HP:0001012,Multiple lipomas,The presence of multiple lipomas (a type of benign tissue made of fatty tissue).,"['Multiple fatty lumps', 'Lipomas', 'Lipomatosis']",Multiple lipomas. The presence of multiple lipomas (a type of benign tissue made of fatty tissue). Multiple fatty lumps. Lipomas. Lipomatosis
HP:0001013,Eruptive xanthomas,"Eruptive xanthomas are yellow-orange-to-red-brown papules that are often surrounded by an erythematous halo. They appear in crops on the buttocks, extensor surfaces of the extremities, and flexural creases. Acutely, variable amounts of pruritus and pain occur.",[],"Eruptive xanthomas. Eruptive xanthomas are yellow-orange-to-red-brown papules that are often surrounded by an erythematous halo. They appear in crops on the buttocks, extensor surfaces of the extremities, and flexural creases. Acutely, variable amounts of pruritus and pain occur. "
HP:0001014,Angiokeratoma,"Angiokeratomas are hyperkeratotic papules that are characterized histologically by superficial ectatic (i.e., dilated) blood vessels with epidermal proliferation. Clinically, angiokeratoma presents as a small, raised, dark-red spot.",['Angiokeratomas'],"Angiokeratoma. Angiokeratomas are hyperkeratotic papules that are characterized histologically by superficial ectatic (i.e., dilated) blood vessels with epidermal proliferation. Clinically, angiokeratoma presents as a small, raised, dark-red spot. Angiokeratomas"
HP:0001015,Prominent superficial veins,"A condition in which superficial veins (i.e., veins just under the skin) are more conspicuous or noticeable than normal.","['Marked subcutaneous veins', 'Prominent veins']","Prominent superficial veins. A condition in which superficial veins (i.e., veins just under the skin) are more conspicuous or noticeable than normal. Marked subcutaneous veins. Prominent veins"
HP:0001017,Anemic pallor,A type of pallor that is secondary to the presence of anemia.,['Anaemic pallor'],Anemic pallor. A type of pallor that is secondary to the presence of anemia. Anaemic pallor
HP:0001018,Abnormal palmar dermatoglyphics,"An abnormality of the dermatoglyphs, i.e., an abnormality of the patterns of ridges of the skin of palm of hand.",[],"Abnormal palmar dermatoglyphics. An abnormality of the dermatoglyphs, i.e., an abnormality of the patterns of ridges of the skin of palm of hand. "
