hpo_id,name,definition,synonyms,text_for_embedding
HP:0000287,Increased facial adipose tissue,An increased amount of subcutaneous fat tissue in the face.,"['Increased amount of facial adipose tissue', 'Increased amount of facial fat', 'Increased volume of facial adipose tissue', 'Facial fat hyperplasia', 'Facial fat hypertrophy', 'Hyperplasia of facial adipose tissue', 'Hypertrophy of facial adipose tissue']",Increased facial adipose tissue. An increased amount of subcutaneous fat tissue in the face. Increased amount of facial adipose tissue. Increased amount of facial fat. Increased volume of facial adipose tissue. Facial fat hyperplasia. Facial fat hypertrophy. Hyperplasia of facial adipose tissue. Hypertrophy of facial adipose tissue
HP:0000288,Abnormality of the philtrum,An abnormality of the philtrum.,"['Abnormal philtrum', 'Abnormality of the infranasal depression', 'Abnormality of the paralabial region']",Abnormality of the philtrum. An abnormality of the philtrum. Abnormal philtrum. Abnormality of the infranasal depression. Abnormality of the paralabial region
HP:0000289,Broad philtrum,"Distance between the philtral ridges, measured just above the vermilion border, more than 2 standard deviations above the mean, or alternatively, an apparently increased distance between the ridges of the philtrum.","['Increased breadth of philtrum', 'Increased horizontal dimension of philtrum', 'Increased transverse dimension of philtrum', 'Increased width of philtrum', 'Wide philtrum']","Broad philtrum. Distance between the philtral ridges, measured just above the vermilion border, more than 2 standard deviations above the mean, or alternatively, an apparently increased distance between the ridges of the philtrum. Increased breadth of philtrum. Increased horizontal dimension of philtrum. Increased transverse dimension of philtrum. Increased width of philtrum. Wide philtrum"
HP:0000290,Abnormal forehead morphology,An anomaly of the forehead.,"['Abnormality of the forehead', 'Abnormality of the frontal region of the face', 'Anomaly of the forehead', 'Deformity of the forehead', 'Malformation of the forehead']",Abnormal forehead morphology. An anomaly of the forehead. Abnormality of the forehead. Abnormality of the frontal region of the face. Anomaly of the forehead. Deformity of the forehead. Malformation of the forehead
HP:0000291,Abnormality of facial adipose tissue,,"['Abnormality of facial fat', 'Deformity of facial adipose tissue', 'Malformation of facial adipose tissue']",Abnormality of facial adipose tissue.  Abnormality of facial fat. Deformity of facial adipose tissue. Malformation of facial adipose tissue
HP:0000292,Loss of facial adipose tissue,Loss of normal subcutaneous fat tissue in the face.,"['Decreased amount of facial adipose tissue', 'Decreased amount of facial fat', 'Decreased volume of facial adipose tissue', 'Loss of facial fat', 'Loss of facial subcutaneous adipose tissue', 'Loss of subcutaneous adipose tissue from face']",Loss of facial adipose tissue. Loss of normal subcutaneous fat tissue in the face. Decreased amount of facial adipose tissue. Decreased amount of facial fat. Decreased volume of facial adipose tissue. Loss of facial fat. Loss of facial subcutaneous adipose tissue. Loss of subcutaneous adipose tissue from face
HP:0000293,Full cheeks,Increased prominence or roundness of soft tissues between zygomata and mandible.,"['Apple cheeks', 'Big cheeks', 'Full cheeks', 'Increased size of cheeks', 'Large cheeks', 'Chubby cheeks', 'Hyperplasia of cheeks', 'Hypertrophy of cheeks', 'Puffy cheeks']",Full cheeks. Increased prominence or roundness of soft tissues between zygomata and mandible. Apple cheeks. Big cheeks. Full cheeks. Increased size of cheeks. Large cheeks. Chubby cheeks. Hyperplasia of cheeks. Hypertrophy of cheeks. Puffy cheeks
HP:0000294,Low anterior hairline,"Distance between the hairline (trichion) and the glabella (the most prominent point on the frontal bone above the root of the nose), in the midline, more than two SD below the mean. Alternatively, an apparently decreased distance between the hairline and the glabella.","['Low frontal hairline', 'Low-set frontal hairline']","Low anterior hairline. Distance between the hairline (trichion) and the glabella (the most prominent point on the frontal bone above the root of the nose), in the midline, more than two SD below the mean. Alternatively, an apparently decreased distance between the hairline and the glabella. Low frontal hairline. Low-set frontal hairline"
HP:0000295,Doll-like facies,"A characteristic facial appearance with a round facial form, full cheeks, a short nose, and a relatively small chin.",['Doll-like facial appearance'],"Doll-like facies. A characteristic facial appearance with a round facial form, full cheeks, a short nose, and a relatively small chin. Doll-like facial appearance"
HP:0000297,Facial hypotonia,Reduced muscle tone of a muscle that is innervated by the facial nerve (the seventh cranial nerve).,"['Decreased facial muscle tone', 'Hypotonic facies', 'Low facial muscle tone', 'Reduced facial muscle tone', 'Atony of facial musculature']",Facial hypotonia. Reduced muscle tone of a muscle that is innervated by the facial nerve (the seventh cranial nerve). Decreased facial muscle tone. Hypotonic facies. Low facial muscle tone. Reduced facial muscle tone. Atony of facial musculature
HP:0000298,Mask-like facies,A lack of facial expression often with staring eyes and a slightly open mouth.,"['Amimia', 'Expressionless face', 'Lack of facial expression', 'Mask-like facial appearance', 'Masklike facies']",Mask-like facies. A lack of facial expression often with staring eyes and a slightly open mouth. Amimia. Expressionless face. Lack of facial expression. Mask-like facial appearance. Masklike facies
HP:0000300,Oval face,A face with a rounded and slightly elongated outline.,"['Oval face', 'Oval facial shape', 'Oval facies']",Oval face. A face with a rounded and slightly elongated outline. Oval face. Oval facial shape. Oval facies
HP:0000301,Abnormality of facial musculature,An anomaly of a muscle that is innervated by the facial nerve (the seventh cranial nerve).,"['Abnormality of facial muscles', 'Facial muscle issue']",Abnormality of facial musculature. An anomaly of a muscle that is innervated by the facial nerve (the seventh cranial nerve). Abnormality of facial muscles. Facial muscle issue
HP:0000303,Mandibular prognathia,Abnormal prominence of the chin related to increased length of the mandible.,"['Hypertrophy of lower jaw', 'Hypertrophy of mandible', 'Big lower jaw', 'Big mandible', 'Enlarged mandible', 'Enlargement of mandible', 'Hyperplasia of lower jaw', 'Increased projection of lower jaw', 'Increased projection of mandible', 'Increased size of lower jaw', 'Large lower jaw', 'Large mandible', 'Lower jaw excess', 'Lower jaw hyperplasia', 'Macromandible', 'Mandible prognathism', 'Mandibular excess', 'Mandibular hyperplasia', 'Mandibular macrognathia', 'Mandibular prognathism', 'Prognathia', 'Prognathism', 'Prominent chin', 'Prominent jaw', 'Prominent lower jaw', 'Prominent mandible', 'Relative mandibular prognathism', 'Increased size of mandible']",Mandibular prognathia. Abnormal prominence of the chin related to increased length of the mandible. Hypertrophy of lower jaw. Hypertrophy of mandible. Big lower jaw. Big mandible. Enlarged mandible. Enlargement of mandible. Hyperplasia of lower jaw. Increased projection of lower jaw. Increased projection of mandible. Increased size of lower jaw. Large lower jaw. Large mandible. Lower jaw excess. Lower jaw hyperplasia. Macromandible. Mandible prognathism. Mandibular excess. Mandibular hyperplasia. Mandibular macrognathia. Mandibular prognathism. Prognathia. Prognathism. Prominent chin. Prominent jaw. Prominent lower jaw. Prominent mandible. Relative mandibular prognathism. Increased size of mandible
HP:0000306,Abnormality of the chin,"An abnormality of the chin, i.e., of the inferior portion of the face lying inferior to the lower lip and including the central prominence of the lower jaw.","['Abnormality of the chin', 'Abnormality of the menton', 'Anomaly of the chin', 'Deformity of the chin', 'Malformation of the chin']","Abnormality of the chin. An abnormality of the chin, i.e., of the inferior portion of the face lying inferior to the lower lip and including the central prominence of the lower jaw. Abnormality of the chin. Abnormality of the menton. Anomaly of the chin. Deformity of the chin. Malformation of the chin"
HP:0000307,Pointed chin,A marked tapering of the lower face to the chin.,"['Pointed chin', 'Pointed mention region', 'Pointy chin', 'Small pointed chin', ""Witch's chin""]",Pointed chin. A marked tapering of the lower face to the chin. Pointed chin. Pointed mention region. Pointy chin. Small pointed chin. Witch's chin
HP:0000308,Microretrognathia,A form of developmental hypoplasia of the mandible in which the mandible is mislocalised posteriorly.,"['Retromicrognathia', 'Small retruded chin']",Microretrognathia. A form of developmental hypoplasia of the mandible in which the mandible is mislocalised posteriorly. Retromicrognathia. Small retruded chin
HP:0000309,Abnormal midface morphology,"An anomaly of the midface, which is a region and not an anatomical term. It extends, superiorly, from the inferior orbital margin to, inferiorly, the level of nasal base. It is formed by the maxilla (upper jaw) and zygoma and cheeks and malar region. Traditionally, the nose and premaxilla are not included in the midface.","['Abnormal morphology of the midface', 'Abnormality of the midface', 'Anomaly of the midface', 'Deformity of the midface', 'Malformation of the midface']","Abnormal midface morphology. An anomaly of the midface, which is a region and not an anatomical term. It extends, superiorly, from the inferior orbital margin to, inferiorly, the level of nasal base. It is formed by the maxilla (upper jaw) and zygoma and cheeks and malar region. Traditionally, the nose and premaxilla are not included in the midface. Abnormal morphology of the midface. Abnormality of the midface. Anomaly of the midface. Deformity of the midface. Malformation of the midface"
HP:0000311,Round face,The facial appearance is more circular than usual as viewed from the front.,"['Round, full face', 'Circular face', 'Round face', 'Round facial appearance', 'Round facial shape', 'Round facies']","Round face. The facial appearance is more circular than usual as viewed from the front. Round, full face. Circular face. Round face. Round facial appearance. Round facial shape. Round facies"
HP:0000315,Abnormality of the orbital region,,"['Abnormality of the eye region', 'Abnormality of the region around the eyes', 'Anomaly of the orbital region of the face', 'Deformity of the orbital region of the face', 'Malformation of the orbital region of the face']",Abnormality of the orbital region.  Abnormality of the eye region. Abnormality of the region around the eyes. Anomaly of the orbital region of the face. Deformity of the orbital region of the face. Malformation of the orbital region of the face
HP:0000316,Hypertelorism,"Interpupillary distance more than 2 SD above the mean (alternatively, the appearance of an increased interpupillary distance or widely spaced eyes).","['Excessive orbital separation', 'Increased distance between eye sockets', 'Increased distance between eyes', 'Increased interpupillary distance', 'Ocular hypertelorism', 'Wide-set eyes', 'Widely spaced eyes', 'Widened interpupillary distance']","Hypertelorism. Interpupillary distance more than 2 SD above the mean (alternatively, the appearance of an increased interpupillary distance or widely spaced eyes). Excessive orbital separation. Increased distance between eye sockets. Increased distance between eyes. Increased interpupillary distance. Ocular hypertelorism. Wide-set eyes. Widely spaced eyes. Widened interpupillary distance"
HP:0000317,Facial myokymia,Facial myokymia is a fine fibrillary activity of one or more muscles innervated by the facial nerve (the seventh cranial nerve).,"['Involuntary facial contraction', 'Involuntary facial quivering']",Facial myokymia. Facial myokymia is a fine fibrillary activity of one or more muscles innervated by the facial nerve (the seventh cranial nerve). Involuntary facial contraction. Involuntary facial quivering
HP:0000319,Smooth philtrum,"Flat skin surface, with no ridge formation in the central region of the upper lip between the nasal base and upper vermilion border.","['Decreased depth of philtrum', 'Flat philtrum', 'Indistinct philtrum', 'Philtrum, smooth', 'Shallow philtrum', 'Simple philtrum']","Smooth philtrum. Flat skin surface, with no ridge formation in the central region of the upper lip between the nasal base and upper vermilion border. Decreased depth of philtrum. Flat philtrum. Indistinct philtrum. Philtrum, smooth. Shallow philtrum. Simple philtrum"
HP:0000320,Bird-like facies,,['Bird-like facial appearance'],Bird-like facies.  Bird-like facial appearance
HP:0000321,Square face,"Facial contours, as viewed from the front, show a broad upper face/cranium and lower face/mandible, creating a square appearance.","['Square face', 'Square facial shape', 'Square facies']","Square face. Facial contours, as viewed from the front, show a broad upper face/cranium and lower face/mandible, creating a square appearance. Square face. Square facial shape. Square facies"
HP:0000322,Short philtrum,"Distance between nasal base and midline upper lip vermilion border more than 2 SD below the mean. Alternatively, an apparently decreased distance between nasal base and midline upper lip vermilion border.","['Decreased height of philtrum', 'Decreased length of philtrum', 'Decreased vertical dimension of philtrum', 'Vertical hypoplasia of philtrum']","Short philtrum. Distance between nasal base and midline upper lip vermilion border more than 2 SD below the mean. Alternatively, an apparently decreased distance between nasal base and midline upper lip vermilion border. Decreased height of philtrum. Decreased length of philtrum. Decreased vertical dimension of philtrum. Vertical hypoplasia of philtrum"
HP:0000324,Facial asymmetry,An abnormal difference between the left and right sides of the face.,"['Asymmetric facies', 'Asymmetry of face', 'Asymmetry of right and left side of face', 'Crooked face', 'Facial asymmetry', 'Unsymmetrical face', 'Unbalanced face', 'Unequal sides of face', 'Uneven face', 'Uneven sides of face']",Facial asymmetry. An abnormal difference between the left and right sides of the face. Asymmetric facies. Asymmetry of face. Asymmetry of right and left side of face. Crooked face. Facial asymmetry. Unsymmetrical face. Unbalanced face. Unequal sides of face. Uneven face. Uneven sides of face
HP:0000325,Triangular face,"Facial contour, as viewed from the front, triangular in shape, with breadth at the temples and tapering to a narrow chin.","['Face with broad temples and narrow chin', 'Inverted triangular face', 'Triangular face', 'Triangular facial shape', 'Triangular facies']","Triangular face. Facial contour, as viewed from the front, triangular in shape, with breadth at the temples and tapering to a narrow chin. Face with broad temples and narrow chin. Inverted triangular face. Triangular face. Triangular facial shape. Triangular facies"
HP:0000326,Abnormal maxilla morphology,An abnormality of the Maxilla (upper jaw bone).,"['Abnormality of the maxilla', 'Abnormality of the upper jaw bone', 'Abnormality of the upper jaw bones', 'Anomaly of the maxilla', 'Deformity of the maxilla', 'Deformity of the upper jaw bones', 'Malformation of the maxilla', 'Malformation of the upper jaw bones']",Abnormal maxilla morphology. An abnormality of the Maxilla (upper jaw bone). Abnormality of the maxilla. Abnormality of the upper jaw bone. Abnormality of the upper jaw bones. Anomaly of the maxilla. Deformity of the maxilla. Deformity of the upper jaw bones. Malformation of the maxilla. Malformation of the upper jaw bones
HP:0000327,Hypoplasia of the maxilla,Abnormally small dimension of the Maxilla. Usually creating a malocclusion or malalignment between the upper and lower teeth or resulting in a deficient amount of projection of the base of the nose and lower midface region.,"['Deficiency of upper jaw bones', 'Decreased size of maxilla', 'Decreased size of upper jaw', 'Hypoplasia of upper jaw bones', 'Hypoplastic maxillary bones', 'Maxillary deficiency', 'Maxillary hypoplasia', 'Maxillary micrognathia', 'Maxillary retrognathia', 'Maxillary retrusion', 'Micromaxilla', 'Small maxilla', 'Small upper jaw', 'Small upper jaw bones', 'Upper jaw deficiency', 'Upper jaw retrusion', 'Decreased projection of maxilla', 'Decreased projection of upper jaw', 'Hypotrophic maxilla', 'Hypotrophic upper jaw bones', 'Retrognathia of upper jaw', 'Retrusion of upper jaw bones']",Hypoplasia of the maxilla. Abnormally small dimension of the Maxilla. Usually creating a malocclusion or malalignment between the upper and lower teeth or resulting in a deficient amount of projection of the base of the nose and lower midface region. Deficiency of upper jaw bones. Decreased size of maxilla. Decreased size of upper jaw. Hypoplasia of upper jaw bones. Hypoplastic maxillary bones. Maxillary deficiency. Maxillary hypoplasia. Maxillary micrognathia. Maxillary retrognathia. Maxillary retrusion. Micromaxilla. Small maxilla. Small upper jaw. Small upper jaw bones. Upper jaw deficiency. Upper jaw retrusion. Decreased projection of maxilla. Decreased projection of upper jaw. Hypotrophic maxilla. Hypotrophic upper jaw bones. Retrognathia of upper jaw. Retrusion of upper jaw bones
HP:0000329,Facial hemangioma,"Hemangioma, a benign tumor of the vascular endothelial cells, occurring in the face.",['Facial hemangiomata'],"Facial hemangioma. Hemangioma, a benign tumor of the vascular endothelial cells, occurring in the face. Facial hemangiomata"
HP:0000331,Short chin,Decreased vertical distance from the vermilion border of the lower lip to the inferior-most point of the chin.,"['Decreased height of chin', 'Short chin', 'Short lower third of face', 'Vertical deficiency of chin', 'Vertical hypoplasia of chin', 'Small chin']",Short chin. Decreased vertical distance from the vermilion border of the lower lip to the inferior-most point of the chin. Decreased height of chin. Short chin. Short lower third of face. Vertical deficiency of chin. Vertical hypoplasia of chin. Small chin
HP:0000336,Prominent supraorbital ridges,Greater than average forward and/or lateral protrusion of the supraorbital portion of the frontal bones.,"['Prominent brow', 'Prominent supraorbital margins', 'Prominent supraorbital ridge', 'Protruding supraorbital ridge', 'Supraorbital hyperostosis', 'Hyperplasia of supraorbital margins', 'Hyperplasia of supraorbital ridge', 'Hypertrophy of supraorbital margins', 'Hypertrophy of supraorbital ridge']",Prominent supraorbital ridges. Greater than average forward and/or lateral protrusion of the supraorbital portion of the frontal bones. Prominent brow. Prominent supraorbital margins. Prominent supraorbital ridge. Protruding supraorbital ridge. Supraorbital hyperostosis. Hyperplasia of supraorbital margins. Hyperplasia of supraorbital ridge. Hypertrophy of supraorbital margins. Hypertrophy of supraorbital ridge
HP:0000337,Broad forehead,Width of the forehead or distance between the frontotemporales is more than two standard deviations above the mean (objective); or apparently increased distance between the two sides of the forehead.,"['Bitemporal widening', 'Broad forehead', 'Increased bitemporal dimension', 'Increased bitemporal width', 'Increased width of the forehead', 'Intertemporal widening', 'Wide forehead']",Broad forehead. Width of the forehead or distance between the frontotemporales is more than two standard deviations above the mean (objective); or apparently increased distance between the two sides of the forehead. Bitemporal widening. Broad forehead. Increased bitemporal dimension. Increased bitemporal width. Increased width of the forehead. Intertemporal widening. Wide forehead
HP:0000338,Hypomimic face,"A reduced degree of motion of the muscles beneath the skin of the face, often associated with reduced facial crease formation.","['Dull facial expression', 'Hypomimia', 'Decreased facial expressions', 'Decreased facial muscle movement']","Hypomimic face. A reduced degree of motion of the muscles beneath the skin of the face, often associated with reduced facial crease formation. Dull facial expression. Hypomimia. Decreased facial expressions. Decreased facial muscle movement"
HP:0000339,Pugilistic facies,Coarse facial features reminiscent of those of a boxer.,"['Boxer-like facial appearance', 'Pugilistic facial appearance']",Pugilistic facies. Coarse facial features reminiscent of those of a boxer. Boxer-like facial appearance. Pugilistic facial appearance
HP:0000340,Sloping forehead,Inclination of the anterior surface of the forehead from the vertical more than two standard deviations above the mean (objective); or apparently excessive posterior sloping of the forehead in a lateral view.,"['Inclined forehead', 'Posteriorly sloping forehead', 'Receding forehead', 'Sloping forehead']",Sloping forehead. Inclination of the anterior surface of the forehead from the vertical more than two standard deviations above the mean (objective); or apparently excessive posterior sloping of the forehead in a lateral view. Inclined forehead. Posteriorly sloping forehead. Receding forehead. Sloping forehead
HP:0000341,Narrow forehead,Width of the forehead or distance between the frontotemporales is more than two standard deviations below the mean (objective); or apparently narrow intertemporal region (subjective).,"['Bitemporal narrowing', 'Bitemporal narrowness', 'Bitemporal skull narrowing', 'Decreased width of the forehead', 'Intertemporal narrowing', 'Narrow bitemporal diameter', 'Narrow bitemporal width', 'Narrow forehead', 'Temporal narrowness']",Narrow forehead. Width of the forehead or distance between the frontotemporales is more than two standard deviations below the mean (objective); or apparently narrow intertemporal region (subjective). Bitemporal narrowing. Bitemporal narrowness. Bitemporal skull narrowing. Decreased width of the forehead. Intertemporal narrowing. Narrow bitemporal diameter. Narrow bitemporal width. Narrow forehead. Temporal narrowness
HP:0000343,Long philtrum,"Distance between nasal base and midline upper lip vermilion border more than 2 SD above the mean. Alternatively, an apparently increased distance between nasal base and midline upper lip vermilion border.","['Elongated philtrum', 'Increased height of philtrum', 'Increased length of philtrum', 'Increased vertical dimension of philtrum', 'Vertical hyperplasia of philtrum']","Long philtrum. Distance between nasal base and midline upper lip vermilion border more than 2 SD above the mean. Alternatively, an apparently increased distance between nasal base and midline upper lip vermilion border. Elongated philtrum. Increased height of philtrum. Increased length of philtrum. Increased vertical dimension of philtrum. Vertical hyperplasia of philtrum"
HP:0000346,Whistling appearance,An abnormality of facial morphology characterized by a small mouth opening and constant contraction of the lips as if the patient were whistling.,"['Whistling appearance', 'Whistling facial appearance']",Whistling appearance. An abnormality of facial morphology characterized by a small mouth opening and constant contraction of the lips as if the patient were whistling. Whistling appearance. Whistling facial appearance
HP:0000347,Micrognathia,Developmental hypoplasia of the mandible.,"['Deficiency of lower jaw', 'Decreased size of lower jaw', 'Decreased size of mandible', 'Hypoplasia of lower jaw', 'Hypoplasia of mandible', 'Hypoplastic mandible', 'Hypoplastic mandible condyle', 'Hypotrophic lower jaw', 'Hypotrophic mandible', 'Little lower jaw', 'Little mandible', 'Lower jaw deficiency', 'Lower jaw hypoplasia', 'Mandibular deficiency', 'Mandibular hypoplasia', 'Mandibular micrognathia', 'Micrognathia of lower jaw', 'Micromandible', 'Robin mandible', 'Severe hypoplasia of mandible', 'Small jaw', 'Small lower jaw', 'Small mandible', 'Underdevelopment of lower jaw', 'Underdevelopment of mandible', 'Decreased projection of lower jaw', 'Decreased projection of mandible']",Micrognathia. Developmental hypoplasia of the mandible. Deficiency of lower jaw. Decreased size of lower jaw. Decreased size of mandible. Hypoplasia of lower jaw. Hypoplasia of mandible. Hypoplastic mandible. Hypoplastic mandible condyle. Hypotrophic lower jaw. Hypotrophic mandible. Little lower jaw. Little mandible. Lower jaw deficiency. Lower jaw hypoplasia. Mandibular deficiency. Mandibular hypoplasia. Mandibular micrognathia. Micrognathia of lower jaw. Micromandible. Robin mandible. Severe hypoplasia of mandible. Small jaw. Small lower jaw. Small mandible. Underdevelopment of lower jaw. Underdevelopment of mandible. Decreased projection of lower jaw. Decreased projection of mandible
HP:0000348,High forehead,An abnormally increased height of the forehead.,"['High forehead', 'Tall forehead']",High forehead. An abnormally increased height of the forehead. High forehead. Tall forehead
HP:0000349,Widow's peak,Frontal hairline with bilateral arcs to a low point in the midline of the forehead.,"['Hairline peak', 'Hairline point', 'Pointed frontal hairline', 'Pointed hairline at front of head', 'V-shaped frontal hairline', ""Widow's peak""]",Widow's peak. Frontal hairline with bilateral arcs to a low point in the midline of the forehead. Hairline peak. Hairline point. Pointed frontal hairline. Pointed hairline at front of head. V-shaped frontal hairline. Widow's peak
